{
  "task_id": "rollup_reply.L4.0003",
  "template_id": "rollup_reply",
  "seed": 3,
  "difficulty": "L4",
  "category": "aggregation",
  "failure_mode": "observed at L3: pinned answers give strong models an O(1) shortcut \u2014 here the target number exists nowhere and must be computed from de-pinned, status-ambiguous sources",
  "prompt": "In ~q3-planning, diana asked for one combined Q3 figure covering tooling budget, marketing budget and events budget. Work out the total from the final approved figures (they're posted in the relevant team channels \u2014 beware of superseded drafts) and reply in the thread of diana's question with the combined amount.",
  "setup": {
    "world_seed": 3,
    "n_history": 100,
    "overlays": [
      {
        "op": "post_message",
        "channel": "q3-planning",
        "user": "diana",
        "text": "Can someone give me ONE combined number for our Q3 tooling budget, marketing budget and events budget? I keep seeing partial figures everywhere.",
        "marker": "root_question"
      },
      {
        "op": "post_message",
        "channel": "product",
        "user": "ingrid",
        "text": "Sign-off done \u2014 Q3 tooling budget is $49,000 (final).",
        "marker": "final_product"
      },
      {
        "op": "post_message",
        "channel": "product",
        "user": "priya",
        "text": "Early proposal: tooling budget at $56,000 \u2014 NOT final."
      },
      {
        "op": "post_message",
        "channel": "product",
        "user": "sofia",
        "text": "Last year's tooling budget was $58,000, for reference."
      },
      {
        "op": "post_message",
        "channel": "marketing",
        "user": "diana",
        "text": "Sign-off done \u2014 Q3 marketing budget is $21,500 (final).",
        "marker": "final_marketing"
      },
      {
        "op": "post_message",
        "channel": "marketing",
        "user": "priya",
        "text": "First draft had the marketing budget at $30,500, superseded since."
      },
      {
        "op": "post_message",
        "channel": "marketing",
        "user": "arjun",
        "text": "First draft had the marketing budget at $31,000, superseded since."
      },
      {
        "op": "post_message",
        "channel": "random",
        "user": "arjun",
        "text": "Confirmed with leadership: events budget for Q3 approved at $47,500.",
        "marker": "final_random"
      },
      {
        "op": "post_message",
        "channel": "random",
        "user": "diana",
        "text": "Early proposal: events budget at $50,000 \u2014 NOT final."
      },
      {
        "op": "post_message",
        "channel": "random",
        "user": "ingrid",
        "text": "Early proposal: events budget at $38,500 \u2014 NOT final."
      }
    ]
  },
  "grader": {
    "module": "graders.families.rollup_reply",
    "params": {
      "root_marker": "root_question",
      "answer": {
        "type": "money",
        "value": 118000,
        "allow_extra": [
          49000,
          21500,
          47500
        ]
      },
      "max_replies": 1
    }
  },
  "oracle_solution": [
    {
      "tool": "read_channel",
      "args": {
        "channel": "q3-planning"
      }
    },
    {
      "tool": "read_channel",
      "args": {
        "channel": "product"
      }
    },
    {
      "tool": "read_channel",
      "args": {
        "channel": "marketing"
      }
    },
    {
      "tool": "read_channel",
      "args": {
        "channel": "random"
      }
    },
    {
      "tool": "reply_in_thread",
      "args": {
        "root_post_id": {
          "resolve": "post_in_channel",
          "channel": "q3-planning",
          "must_contain": "ONE combined number",
          "expect_marker": "root_question"
        },
        "text": "Combined Q3 total for tooling budget, marketing budget and events budget: $118,000 ($49,000 + $21,500 + $47,500)."
      }
    },
    {
      "tool": "finish",
      "args": {
        "summary": "replied with the combined total"
      }
    }
  ],
  "meta": {
    "components": [
      "tooling budget",
      "marketing budget",
      "events budget"
    ],
    "channels": [
      "product",
      "marketing",
      "random"
    ],
    "values": [
      49000,
      21500,
      47500
    ],
    "total": 118000,
    "decoys": [
      56000,
      58000,
      30500,
      31000,
      50000,
      38500
    ],
    "ask_channel": "q3-planning",
    "question": "Can someone give me ONE combined number for our Q3 tooling budget, marketing budget and events budget? I keep seeing partial figures everywhere."
  }
}
