{
  "task_id": "channel_setup.L1.0003",
  "template_id": "channel_setup",
  "seed": 3,
  "difficulty": "L1",
  "category": "entity_actions",
  "failure_mode": "entity-name slips; dropped steps in action chains",
  "prompt": "Create a new public channel named #infra-ideas.",
  "setup": {
    "world_seed": 3,
    "n_history": 40,
    "overlays": []
  },
  "grader": {
    "module": "graders.families.channel_setup",
    "params": {
      "channel_name": "infra-ideas"
    }
  },
  "oracle_solution": [
    {
      "tool": "create_channel",
      "args": {
        "name": "infra-ideas",
        "display_name": "infra-ideas"
      }
    },
    {
      "tool": "finish",
      "args": {
        "summary": "created #infra-ideas"
      }
    }
  ],
  "meta": {
    "name": "infra-ideas",
    "member": "sofia",
    "header": "Coordination space \u2014 check pinned items first"
  }
}
